{
  "SP_clause_ledger": {
    "SP0": {
      "component_support": "separate pinned hashes",
      "missing_gate": "G0",
      "physical_satisfied": false
    },
    "SP1": {
      "component_support": "radial evaluation at H",
      "missing_gate": "G0",
      "physical_satisfied": false
    },
    "SP2": {
      "component_support": "T39 anchored QJ1 scheme",
      "missing_gate": "G0",
      "physical_satisfied": false
    },
    "SP3": {
      "component_support": "T39 action-Hessian preservation",
      "missing_gate": "G0+G1",
      "physical_satisfied": false
    },
    "SP4": {
      "component_support": "A35 internal unit line",
      "missing_gate": "G1",
      "physical_satisfied": false
    },
    "SP5": {
      "component_support": "cotangent retract, local-formal state existence and free shell pushforward",
      "missing_gate": "G2",
      "physical_satisfied": false
    }
  },
  "check_summary": {
    "failed": [],
    "passed": 103,
    "total": 103
  },
  "checks": {
    "A35_action_weight_open": true,
    "A35_certificate_passes": true,
    "A35_rank_one": true,
    "A35_unit_magnitude": true,
    "G0_hashes_distinct": true,
    "G0_maps_SP0_to_SP3": true,
    "G0_nonimplication": true,
    "G0_open": true,
    "G1_defect_three": true,
    "G1_maps_SP4": true,
    "G1_nonimplication": true,
    "G1_open": true,
    "G2_maps_SP5": true,
    "G2_nonimplication": true,
    "G2_open": true,
    "G2_two_states": true,
    "H4_certificate_passes": true,
    "H4_cotangent_closed": true,
    "H4_direct_identification_open": true,
    "T38_builder_closed": true,
    "T39_builder_closed": true,
    "T40_builder_closed": true,
    "action_QJ1_component_closed": true,
    "action_QJ2_component_closed": true,
    "action_not_derived_from_upper": true,
    "all_component_certificates": true,
    "component_counter_4_of_4": true,
    "cotangent_contraction": true,
    "cotangent_pi": true,
    "cotangent_symplectic_differential": true,
    "cotangent_symplectic_inclusion": true,
    "discarded_pairing_killed": true,
    "discarded_pairing_nonzero": true,
    "domains_not_identified": true,
    "evaluation_not_BV_projection": true,
    "finite_shell_certificate_passes": true,
    "fixed_coupling_open": true,
    "four_components": true,
    "free_shell_closed": true,
    "gluing_counter_0_of_3": true,
    "gravity_QJ0_open": true,
    "jet_C_idempotent": true,
    "jet_C_right_inverse": true,
    "jet_R_idempotent": true,
    "jet_R_kernel": true,
    "jet_det_54": true,
    "no_physical_SP_clause": true,
    "packet_counter_unchanged": true,
    "physical_QJ1_open": true,
    "physical_QJ2_open": true,
    "physical_projection_open": true,
    "preferred_state_not_promoted": true,
    "primal_contraction": true,
    "primal_pi": true,
    "primal_side_conditions": true,
    "product_not_fiber_product": true,
    "promotion_existence_open": true,
    "promotion_necessary": true,
    "promotion_sufficient": true,
    "radial_component_positive": true,
    "radial_component_unique_marginal": true,
    "radial_does_not_select_full_state": true,
    "radial_variance_zero": true,
    "row_counter_unchanged": true,
    "schema_claim_id": true,
    "schema_requires_all_fields": true,
    "shell_Delta_identity": true,
    "shell_Lagrangian": true,
    "shell_Q2": true,
    "shell_Q_symplectic": true,
    "shell_contraction": true,
    "shell_det_minus_one": true,
    "shell_nondegenerate": true,
    "six_SP_clauses": true,
    "source_01_hash_matches": true,
    "source_02_hash_matches": true,
    "source_03_hash_matches": true,
    "source_04_hash_matches": true,
    "source_05_hash_matches": true,
    "source_06_hash_matches": true,
    "source_07_hash_matches": true,
    "source_08_hash_matches": true,
    "source_09_hash_matches": true,
    "source_10_hash_matches": true,
    "source_11_hash_matches": true,
    "source_12_hash_matches": true,
    "source_13_hash_matches": true,
    "source_14_hash_matches": true,
    "source_15_hash_matches": true,
    "state_certificate_passes": true,
    "state_expectations_distinct": true,
    "theorem_component_product_boundary": true,
    "theorem_if_and_only_if": true,
    "theorem_metric_witness": true,
    "theorem_physical_counters": true,
    "theorem_state_witness": true,
    "theorem_three_gates": true,
    "two_states_normalized": true,
    "two_states_positive": true,
    "zero_fits": true,
    "zero_new_parameters": true,
    "zero_new_selectors": true,
    "zero_observed_inputs": true
  },
  "claim_id": "CBF.T41",
  "component_packets_assembled": 4,
  "component_packets_total": 4,
  "component_product": {
    "all_component_certificates_pass": true,
    "component_count": 4,
    "component_domains_identified_by_one_map": false,
    "component_product_is_physical_fiber_product": false,
    "notation": "P_sep=P_state x P_jet x P_line x P_BV^free",
    "observable_evaluation_is_covariant_BV_field_projection": false,
    "status": "MAXIMAL_LOCAL_FORMAL_COMPONENT_PRODUCT_CLOSED_PHYSICAL_FIBER_PRODUCT_OPEN"
  },
  "date": "2026-08-30",
  "exact_finite_witness": {
    "action_jet_retraction": {
      "C_H_idempotent": true,
      "R_H_idempotent": true,
      "anchor_H": "3/2",
      "counterterm_projection_C_H": [
        [
          "1",
          "9/16",
          "0",
          "-27/64",
          "0"
        ],
        [
          "0",
          "0",
          "0",
          "0",
          "0"
        ],
        [
          "0",
          "1/2",
          "1",
          "9/8",
          "0"
        ],
        [
          "0",
          "0",
          "0",
          "0",
          "0"
        ],
        [
          "0",
          "-1/27",
          "0",
          "1/4",
          "1"
        ]
      ],
      "jet_C_H_equals_jet": true,
      "jet_R_H_zero": true,
      "jet_matrix": [
        [
          "1",
          "3/2",
          "9/4",
          "27/8",
          "81/16"
        ],
        [
          "0",
          "1",
          "3",
          "27/4",
          "27/2"
        ],
        [
          "0",
          "0",
          "2",
          "9",
          "27"
        ]
      ],
      "polynomial_basis": [
        "1",
        "h",
        "h^2",
        "h^3",
        "h^4"
      ],
      "remainder_retraction_R_H": [
        [
          "0",
          "-9/16",
          "0",
          "27/64",
          "0"
        ],
        [
          "0",
          "1",
          "0",
          "0",
          "0"
        ],
        [
          "0",
          "-1/2",
          "0",
          "-9/8",
          "0"
        ],
        [
          "0",
          "0",
          "0",
          "1",
          "0"
        ],
        [
          "0",
          "1/27",
          "0",
          "-1/4",
          "0"
        ]
      ],
      "restricted_even_determinant": "54",
      "restricted_even_jet_matrix": [
        [
          "1",
          "9/4",
          "81/16"
        ],
        [
          "0",
          "3",
          "27/2"
        ],
        [
          "0",
          "2",
          "27"
        ]
      ],
      "symbolic_determinant": "16 H^3"
    },
    "cotangent_contraction": {
      "cotangent_contraction_identity": true,
      "cotangent_differential": [
        [
          "0",
          "0",
          "0",
          "0",
          "0",
          "0",
          "0",
          "0"
        ],
        [
          "0",
          "0",
          "0",
          "0",
          "0",
          "0",
          "0",
          "0"
        ],
        [
          "0",
          "0",
          "0",
          "0",
          "0",
          "0",
          "0",
          "0"
        ],
        [
          "0",
          "0",
          "1",
          "0",
          "0",
          "0",
          "0",
          "0"
        ],
        [
          "0",
          "0",
          "0",
          "0",
          "0",
          "0",
          "0",
          "0"
        ],
        [
          "0",
          "0",
          "0",
          "0",
          "0",
          "0",
          "0",
          "0"
        ],
        [
          "0",
          "0",
          "0",
          "0",
          "0",
          "0",
          "0",
          "-1"
        ],
        [
          "0",
          "0",
          "0",
          "0",
          "0",
          "0",
          "0",
          "0"
        ]
      ],
      "cotangent_differential_is_symplectic": true,
      "cotangent_homotopy": [
        [
          "0",
          "0",
          "0",
          "0",
          "0",
          "0",
          "0",
          "0"
        ],
        [
          "0",
          "0",
          "0",
          "0",
          "0",
          "0",
          "0",
          "0"
        ],
        [
          "0",
          "0",
          "0",
          "1",
          "0",
          "0",
          "0",
          "0"
        ],
        [
          "0",
          "0",
          "0",
          "0",
          "0",
          "0",
          "0",
          "0"
        ],
        [
          "0",
          "0",
          "0",
          "0",
          "0",
          "0",
          "0",
          "0"
        ],
        [
          "0",
          "0",
          "0",
          "0",
          "0",
          "0",
          "0",
          "0"
        ],
        [
          "0",
          "0",
          "0",
          "0",
          "0",
          "0",
          "0",
          "0"
        ],
        [
          "0",
          "0",
          "0",
          "0",
          "0",
          "0",
          "-1",
          "0"
        ]
      ],
      "cotangent_inclusion": [
        [
          "1",
          "0",
          "0",
          "0"
        ],
        [
          "0",
          "1",
          "0",
          "0"
        ],
        [
          "0",
          "0",
          "0",
          "0"
        ],
        [
          "0",
          "0",
          "0",
          "0"
        ],
        [
          "0",
          "0",
          "1",